{
    "schema_version": "3.0",
    "source": "chrome-extension",
    "app": "salesforce",
    "session_id": "harness-salesforce-001",
    "task_id": "harness-recording",
    "task_run_id": "harness-salesforce-run-001",
    "status": "completed",
    "started_at": "2026-06-05T13:00:00.000Z",
    "ended_at": "2026-06-05T13:00:45.000Z",
    "duration_ms": 45000,
    "total_ms": 45000,
    "active_ms": 35000,
    "idle_ms": 10000,
    "idle_gap_count": 2,
    "dimensions": {
        "url": "https://salesforce.example/app/contacts/new",
        "viewport": "1024x768"
    },
    "metrics": {
        "clicks": {
            "total": 12,
            "ceremonial": 1,
            "wasted": 0
        },
        "target_effort": {
            "average_id": 3.8,
            "max_id": 6.2,
            "max_distance_px": 850,
            "max_target_width_px": 40
        },
        "scroll": {
            "total_px": 2500,
            "page_px": 1500,
            "container_px": 1000,
            "horizontal_px": 0
        },
        "cursor": {
            "total_px": 18000,
            "move_events": 360
        },
        "input": {
            "context_switches": 5,
            "longest_keyboard_streak": 15,
            "longest_mouse_streak": 4,
            "shortcuts_used": 2
        }
    }
}
